"","...1","text","arousal","annotator"
"101",1,"She was like a savage wreaking vengeance upon some brazen victim.","H","Landry"
"10",2,"Don't  bang his head,"" he  cried with unexpected tenderness.","H","Adriana"
"94",3,"""Well, then, go and fetch it,"" said Nurse, but she was not attending; she wanted to go on with what she was saying to Mrs C. about the grocer's daughter.","L","Davide"
"97",4,"Ultimately the sailor, disgusted with the sordid meanness of that impenitent thief, deserted from the schooner.","H","Davide"
"117",5,"A happy marriage, she thought, that's what I was feeling all the time.","L","Landry"
"67",6,"What strength or courage could avail against an enemy armed with such mysterious powers?","L","Davide"
"141",7,"but hobbled to her feet again, pulled herself up, and again with her sidelong leer which slipped and turned aside even from her own face, and her own sorrows, stood and gaped in the glass, aimlessly smiling, and began again the old amble and hobble, taking up mats, putting down china, looking sideways in the glass, as if, after all, she had her consolations, as if indeed there twined about her dirge some incorrigible hope.","L","Landry"
"135",8,"Is it good, is it bad, is it right or wrong?","H","Landry"
"89",9,"A bitterly mocking smile  touched the lips of the young man.","L","Davide"
"54",10,"Her feeling of happiness returned to her, her unreasonable exaltation.","H","Davide"
"71",11,"When the  lieutenant turned his back on him Peyrol's pointing arm fell down by his  side; but he watched the lieutenant out of sight before he turned too  and moved in a contrary direction.","L","Davide"
"23",12,"""Was ever such bad luck and such bad management, too?","L","Adriana"
"32",13,"He had almost forgotten why he was there, and dreamily he could see all his past life on the smooth and boundless surface that glittered before his eyes.","H","Adriana"
"61",14,"And he had never run a penny into debt; he had never cost his father a penny since he was fifteen; he had helped them at home out of his savings; he was educating his sister.","L","Davide"
"104",15,"""I've got a good deal to say,"" our prisoner said slowly.","L","Landry"
"143",16,"There at the back of the house, squatting on his heels on scattered embers, in close proximity to the great iron boiler, where the family daily rice was being cooked by the women under Mrs. Almayer's superintendence, did that astute negotiator carry on long conversations in Sulu language with Almayer's wife.","L","Landry"
"26",17,"For they must fight tyranny to the death, she thought.","H","Adriana"
"64",18,"Mary rose, went to the table, spread out her papers under the green-shaded lamp and, with an action that was becoming a habit, twisted a lock of hair round and round in her fingers.","L","Davide"
"35",19,"""Because I can't  allow any man to behave to me in that way,"" Cassandra replied, and she added, ""particularly when I know that he is engaged to some one else.""","L","Adriana"
"152",20,"I might have said ""Yes,"" and gone back to nursery obscurity, and there, perhaps, mouldered for the rest of my life; but looking up at Madame, I saw in her countenance a something that made me think twice ere I decided.","L","Sveta"
"68",21,"Young Jefferson Hope rode on with his companions, gloomy and taciturn.","L","Davide"
"43",22,"May God long preserve to you the blessings of peace and innocence!","L","Adriana"
"150",23,"They meant that she would in all probability marry some young man whose mother they respected.","L","Landry"
"115",24,"His mother possessed a good development of benevolence, but he owned a better and larger.","H","Landry"
"127",25,"For a moment it stayed trembling in a painful but exciting ecstasy in the air.","H","Landry"
"85",26,"Apparently she found there the confirmation of the words just said, for a feeling of grateful security lightened for her the weight of sorrow at the hour of parting.","L","Davide"
"189",27,"Good-by, my wise, dear, grave little god-daughter.","H","Sveta"
"75",28,"From the middle of the gulf the point of the land itself is not visible at all; but the shoulder of a steep hill at the back can be made out faintly like a shadow on the sky.","L","Davide"
"59",29,"I hope you have made a good bargain in case you come back safe from this adventure.""","L","Davide"
"160",30,"She turned her back on him contemptuously, and said curtly, ""Come  along, aunt,"" and went to the door leading to the passage.","L","Sveta"
"52",31,"You, whom no persuasion can induce to pass a bull, however quiet he looks, would have firmly shown my housekeeper she had done wrong; then you would have gently and wisely admonished her; and at last, I dare say, provided she had seemed penitent, you would have very sweetly forgiven her.","L","Davide"
"37",32,"""Their last move of eight o'clock last night was to organize themselves into a Monterist Committee which sits, as far as I know, in a posada kept by a retired Mexican bull-fighter, a great politician, too, whose name I have forgotten.","L","Adriana"
"171",33,"The marks in the road showed me that the horse had wandered on in a way which would have been impossible had there been anyone in charge of it.","L","Sveta"
"77",34,"But what do YOU find insoluble, I asked him, looking at the mahogany man, the clean-shaven, rosy-gilled, mutton-fed man - "" ""The man in a newspaper office,"" North checked her, ""who knew your father.","L","Davide"
"81",35,"My tale draws to its close: one word respecting my experience of married life, and one brief glance at the fortunes of those whose names have most frequently recurred in this narrative, and I have done.","L","Davide"
"146",36,"On the death of Sir Charles we inquired for this young gentleman and found that he had been farming in Canada.","H","Landry"
"107",37,"She kept a fine flock of yellow chickens, sketched a little, certain rose-trees in the garden were committed specially to her care; and what with the care of the house, the care of the chickens, and the care of the poor, she scarcely knew what it was to have an idle minute.","L","Landry"
"149",38,"Giorgio Viola, whom he saw from afar, sitting on a bench under the front wall of the cottage, lifted his arm slightly to his loud hail.","L","Landry"
"108",39,"The autumn trees gleam in the yellow moonlight, in the light of harvest moons, the light which mellows the energy of labour, and smooths the stubble, and brings the wave lapping blue to the shore.","L","Landry"
"169",40,"On the other hand a wild chaos of boulders and debris made all advance impossible.","H","Sveta"
"5",41,"""You would lose your money,"" Sherlock Holmes remarked calmly.","H","Adriana"
"28",42,"Your folly shall betray you into poverty, misery, starvation.","H","Adriana"
"194",43,"His vitality was pleasant, Mary thought, although he made her laugh.","H","Sveta"
"27",44,"Paul set forth on a pilgrimage to Rome; the house was left quite empty, but for me, a servant, and a poor deformed and imbecile pupil, a sort of cretin, whom her stepmother in a distant province would not allow to return home.","L","Adriana"
"128",45,"She dared not question William; he was inscrutable; he never seemed even to follow the other couple with curiosity when they separated, as they frequently did, to name a plant, or examine a fresco.","L","Landry"
"184",46,"He need fear no desertion as long as some hope remains of that enormous plunder turning up.","H","Sveta"
"93",47,"I could comprehend the feeling, and share both its strength and truth.","L","Davide"
"95",48,"Because he's a priest, a mystery monger, he thought; feeling his coldness; this guardian of beautiful words.","L","Davide"
"163",49,"""You are no ruin, sir - no lightning-struck tree: you are green and vigorous.","H","Sveta"
"80",50,"Perhaps you would have the kindness to spare me half an hour, for there are one or two things that I badly want to say to you.""","L","Davide"
"187",51,"I do not know what kind of creatures inhabit such a thicket, but several times we heard the plunging of large, heavy animals quite close to us.","L","Sveta"
"21",52,"That girl would have had a right to hate me, except that, when school was over and her companions departing, I ordered her to stay, and when they were gone, I did what I had never done to one among them before -  pressed her to my heart and kissed her cheek.","H","Adriana"
"144",53,"He was  feeling vaguely, that in all his good intentions there was something  wanting.","L","Landry"
"38",54,"She had a great admiration for Mrs Levy, who was dying of cancer.","L","Adriana"
"188",55,"A terrible scream - a prolonged yell of horror and anguish burst out of the silence of the moor.","H","Sveta"
"65",56,"But if Duffus, she began - here the omnibus stopped; she looked up; she rose "" - if Duffus thinks he can bully me,"" she said as she went down the steps, ""he'll find he's mistaken.""","L","Davide"
"140",57,"From the Sierra Nevada to Nebraska, and from the Yellowstone River in the north to the Colorado upon the south, is a region of desolation and silence.","L","Landry"
"105",58,"After you left I sent down to Stamford's for the Ordnance map of this portion of the moor, and my spirit has hovered over it all day.","L","Landry"
"72",59,"I hope this delay will not have increased the difficulty of securing it.""","L","Davide"
"88",60,"Might I ask you to hand me my violin, and we will postpone all further thought upon this business until we have had the advantage of meeting Dr. Mortimer and Sir Henry Baskerville in the morning.""","L","Davide"
"182",61,"As often happens in the gulf when the showers during the first part of the night had been frequent and heavy, the darkness had thinned considerably towards the morning though there were no signs of daylight as yet.","L","Sveta"
"106",62,"The last was effected without difficulty by a company of soldiers swarming with a rush over the gangways as she lay alongside the quay; but the lieutenant charged with the duty of arresting the telegraphist halted on the way before the only cafe in Esmeralda, where he distributed some brandy to his men, and refreshed himself at the expense of the owner, a known Ribierist.","H","Landry"
"183",63,"Bolt was glad to obey, for he was tired and hungry after his dismal  failure.","H","Sveta"
"193",64,"Adele now petitioned to go down; but I took her on my knee, and gave her to understand that she must not on any account think of venturing in sight of the ladies, either now or at any other time, unless expressly sent for: that Mr. Rochester would be very angry,  c. ""Some natural tears she shed"" on being told this; but as I began to look very grave, she consented at last to wipe them.","L","Sveta"
"12",65,"But now her true self had returned matured in its mysterious exile,  hopeful and eager for love.","H","Adriana"
"40",66,"He stepped back to look at his work admiringly, feeling very proud.","H","Adriana"
"62",67,"Mr. Helstone looked round uneasily once or twice, as if he wished her away; but she was gazing from the window, and did not seem to mind him: so he continued the perusal of his morning paper - a particularly interesting one it chanced to be, as new movements had just taken place in the Peninsula, and certain columns of the journal were rich in long dispatches from General Lord Wellington.","L","Davide"
"100",68,"He took the tumbler with a shaking hand, and as he drank his teeth chattered against the glass which he drained and set down heavily on the table.","L","Davide"
"86",69,"It was one's body feeling, not one's mind.","L","Davide"
"96",70,"I am conscious myself of a weight at my heart and a feeling of impending danger - ever present dan- ger, which is the more terrible because I am unable to define it.","H","Davide"
"92",71,"Nearly all of them were totally ruined - an irreparable loss.","H","Davide"
"9",72,"I resolved, in the depth of my heart, that I would be most moderate - most correct; and, having reflected a few minutes in order to arrange coherently what I had to say, I told her all the story of my sad childhood.","L","Adriana"
"109",73,"""And mind,"" he continued, ""don't  bother me with any details of the anatomical process, or any notice of the condition of the entrails: let your operation be conducted in silence: tiens-toi tranquille, enfant; comprends-tu?""","H","Landry"
"69",74,"It had been otherwise in his time when men fought against tyranny, in the forests of Brazil, or on the plains of Uruguay, starving on half-raw beef without salt, half naked, with often only a knife tied to a stick for a weapon.","H","Davide"
"31",75,"""My daughter is very young--she is scarce of an age to marry.""","L","Adriana"
"162",76,"He also objected to the Arabs being made use of in that matter; but he suggested Almayer, saying that he was a weak man easily persuaded, and that his friend, the English captain of the steamer, could be made very useful - very likely even would join in the business, smuggling the powder in the steamer without Abdulla's knowledge.","H","Sveta"
"45",77,"On this occasion her arrogant feeling that she could direct everybody dwindled away.","L","Adriana"
"22",78,"Sykes, for instance, when his dressing-shop was set on fire and burned to the ground, when the cloth was torn from his tenters and left in shreds in the field, took no steps to discover or punish the miscreants: he gave up as tamely as a rabbit under the jaws of a ferret.","H","Adriana"
"120",79,"""Truth is not for everybody to know,"" mumbled Peyrol, with a sinking  sensation as though the very ground were going soft under his feet.","H","Landry"
"145",80,"""So am I, Joe,"" replied Shirley, who had rather a pleasure in teasing the overlooker, by persisting in talking on subjects with which he opined she, as a woman, had no right to meddle - ""partly, at least.","H","Landry"
"33",81,"A feeling of peace  sank into him, not unmingled with pride.","L","Adriana"
"195",82,"Her features lost the appearance of stony indifference that had exasperated her father into his outburst of anger and sorrow.","H","Sveta"
"83",83,"The risk of it was not so much deadly as particularly odious.","L","Davide"
"13",84,"So she flitted - her figure, enlarging as it was, still allowed her to glide between table and chair - hither and thither; removed the fire-screen and set a light, before he could stop her, to the grudging lodging-house fire.","H","Adriana"
"191",85,"It may be the extreme of mortal misery, it may be sheer waste of time, and fruitless torture of feeling.","H","Sveta"
"110",86,"For the whole world seemed to have dissolved in this early morning hour into a pool of thought, a deep basin of reality, and one could almost fancy that had Mr. Carmichael spoken, for instance, a little tear would have rent the surface pool.","H","Landry"
"84",87,"She tried to whip up some feeling of affection, of pity.","L","Davide"
"20",88,"And, perhaps, one day his snow-sepulchre will open, spring's softness will return, the sun and south-wind will reach him; the budding of hedges, and carolling of birds, and singing of liberated streams, will call him to kindly resurrection.","H","Adriana"
"142",89,"Confidence has made her honest; forbearance has made her kind-hearted.","L","Landry"
"155",90,"They'll say that all their lives, she thought, and an exquisite scent of olives and oil and juice rose from the great brown dish as Marthe, with a little flourish, took the cover off.","L","Sveta"
"176",91,"Thus we find such modern creatures as the tapir - an animal with quite a respectable length of pedigree - the great deer, and the ant-eater in the companionship of reptilian forms of jurassic type.","L","Sveta"
"122",92,"It is true that we had made a strict resolution against firing, but if it seemed to them that I might be in danger they would not hesitate.","H","Landry"
"99",93,"So, between the old sinner and the young one the girl has had a pretty bad time.""","L","Davide"
"119",94,"The unfortunate delay can be apportioned between a blundering pilot and an intrusive sandbank.","L","Landry"
"15",95,"A ferocious beast would surely have destroyed them and left their remains.","H","Adriana"
"190",96,"When the dawn of Christmas morning broke, my Frank was with God.","L","Sveta"
"158",97,"Anybody may blame me who likes, when I add further, that, now and then, when I took a walk by myself in the grounds; when I went down to the gates and looked through them along the road; or when, while Adele played with her nurse, and Mrs. Fairfax made jellies in the storeroom, I climbed the three staircases, raised the trap-door of the attic, and having reached the leads, looked out afar over sequestered field and hill, and along dim sky-line - that then I longed for a power of vision which might overpass that limit; which might reach the busy world, towns, regions full of life I had heard of but never seen - that then I desired more of practical experience than I possessed; more of intercourse with my kind, of acquaintance with variety of character, than was here within my reach.","L","Sveta"
"63",98,"""I shall go grey, I fear, before the ring is on my finger,"" she said, slowly, keeping her gaze fastened upon him.","L","Davide"
"139",99,"For this reason I saw a good deal of Sir Charles Baskerville.","H","Landry"
"74",100,"He gave that, too; and in the doorway paused for a moment to look at the flat face of the San Tome mountain with a faint frown.","L","Davide"
"136",101,"Looking through the darkness, she marked the swelling ground and the tree.","H","Landry"
"126",102,"Where the real sex feeling begins, timidity and distrust are its companions, heritage from old wicked days when love and violence went often hand in hand.","H","Landry"
"166",103,"Trouble no quiet, kind heart; leave sunny imaginations hope.","L","Sveta"
"11",104,"I should say she has a good deal of literary feeling.""","L","Adriana"
"198",105,"What she said was very simple, but her words, even ""Your tea, William,"" were set down as gently and cautiously and exactly as the feet of a Persian cat stepping among China ornaments.","L","Sveta"
"161",106,"""Your nervous system bore a good share of the suffering?""","H","Sveta"
"6",107,"""How can I love the man you're engaged to marry?""","H","Adriana"
"113",108,"He saw Satan, and Sin his daughter, and Death their horrible offspring.","H","Landry"
"111",109,"Evidently Lakamba's mercy went so far - for in a short while he came out from behind the curtain - but it did not go to the length of inducing him to make an extensive toilet.","L","Landry"
"192",110,"Not wishing him to go quite away, only desiring he should feel that such a transport as he had that day given way to, could not be indulged with perfect impunity, I was not sorry to see him, soon after, gardening in the berceau.","L","Sveta"
"78",111,"""God grant me a little comfort before I die!""","L","Davide"
"98",112,"In more fertile spots the observer would have come to the conclusion that one of those great herds of bisons which graze upon the prairie land was approaching him.","L","Davide"
"167",113,"Her husband was in great spirits tonight, and wishing, she supposed, to make it all right with old Augustus after that scene about the soup, had drawn him in -  they were telling stories about some one they had both known at college.","H","Sveta"
"121",114,"It smeared the window where the Jew boy from Birmingham sat mugging up Greek with a wet towel round his head; where Dr. Malone sat up late writing another chapter in his monumental history of the college.","H","Landry"
"70",115,"His Honor a pretty title, but still, not at the top of the tree.","L","Davide"
"134",116,"He filled her with terror and with an almost unbearable feeling of pity.","H","Landry"
"170",117,"""As white as clay or death,"" was responded.","L","Sveta"
"8",118,"To me he seems now all sacred, his locks are inaccessible, and, Lucy, I feel a sort of fear, when I look at his firm, marble chin, at his straight Greek features.","H","Adriana"
"47",119,"Entering the house, they repaired to the darkened dining-room, through the open windows of which apartment stole the evening air, bearing the perfume of flowers from the garden, the very distant sound of far-retreating steps from the road, and a soft, vague murmur whose origin Caroline explained by the remark, uttered as she stood listening at the casement, ""Shirley, I hear the beck in the Hollow.""","L","Adriana"
"133",120,"As if any interruption would break the frail shape she was building on the table she turned her back to the window lest Mr. Ramsay should see her.","H","Landry"
"79",121,"The wise adviser would be the first victim, no doubt, and death would be his reward.","L","Davide"
"177",122,"Katharine had forgotten to remove this token of her star-gazing.","L","Sveta"
"46",123,"If I DO go with him - if I DO make the sacrifice he urges, I will make it absolutely: I will throw all on the altar - heart, vitals, the entire victim.","L","Adriana"
"87",124,"Without hurry or flutter he opened a book; found his place; read out a passage, upon which old Curry nodded, and made a note in the great volume that lay open in front of him.","L","Davide"
"53",125,"You are aware that I am not a very sound sleeper, and since I have been on guard in this house my slumbers have been lighter than ever.","L","Davide"
"7",126,"Stars above, stars all round him; and from the stars under his feet rose a whisper full of entreaties and tears, and sorrowful faces flitted amongst the clusters of light filling the infinite space below.","H","Adriana"
"24",127,"He was a long chap, with a red face, the lower part muffled round----"" ""That will do,"" cried Holmes.","L","Adriana"
"82",128,"Almayer's elaborately calm demeanour gave way in a moment to an outburst of violent indignation.","H","Davide"
"16",129,"The inhabitants got used to the sight of comings and goings between Almayer's house and the vessel, now moored to the opposite bank, and speculation as to the feverish activity displayed by Almayer's boatmen in repairing old canoes ceased to interfere with the due discharge of domestic duties by the women of the Settlement.","L","Adriana"
"25",130,"The woman's words came with an intense earnestness which carried conviction with them.","L","Adriana"
"185",131,"""Living, as I do, in an educated and scientific atmosphere, I could not have conceived that the first principles of zoology were so little known.","L","Sveta"
"154",132,"Still she would hold off, and now she would assert for a brief season some of those prides and airs the due of her beauty which she was generally utterly without; would turn her head; would look so, over her shoulder, always with some Minta, Paul, or William Bankes at her side.","L","Sveta"
"178",133,"At first exciting, then it became boring and finally intolerable.","H","Sveta"
"173",134,"Your glory shall be great, and your reward in powerful friendship.","L","Sveta"
"60",135,"And again, as she intercepted his cup in passing, and would stir the sugar, and put in the cream herself, ""I always did it for you at home; papa: nobody could do it as well, not even your own self.""","L","Davide"
"138",136,"said his mother, hiding a glad smile and speaking curtly.","H","Landry"
"151",137,"He had sworn a mighty oath to marry her to a white man before he went home and to leave her all his money.","H","Sveta"
"49",138,"At last in the stress of her fear she did that which might have daunted the bravest or most active man, for by the aid of the growth of ivy which covered  and still covers  the south wall she came down from under the eaves, and so homeward across the moor, there being three leagues betwixt the Hall and her father's farm.","H","Adriana"
"42",139,"""An Arab trader of this place has sent the information about your goings on here to Batavia, a couple of months ago,"" said the officer.","L","Adriana"
"103",140,"Perhaps he might bring help; but in any case he would ensure that our lives were not spent for nothing, and that news of all that we had won for Science should reach our friends at home.","L","Landry"
"14",141,"Nor was I; but I was a good deal interested and excited.","L","Adriana"
"125",142,"She breathed into the feeling softness; she poured round the passion force.","H","Landry"
"1",143,"Scorn for scorn, contempt for contempt, hate for hate.","H","Adriana"
"137",144,"Sitting on the floor with her arms round Mrs. Ramsay's knees, close as she could get, smiling to think that Mrs. Ramsay would never know the reason of that pressure, she imagined how in the chambers of the mind and heart of the woman who was, physically, touching her, were stood, like the treasures in the tombs of kings, tablets bearing sacred inscriptions, which if one could spell them out, would teach one everything, but they would never be offered openly, never made public.","L","Landry"
"30",145,"I only had three pairs in the world - the new brown, the old black, and the patent leath- ers, which I am wearing.","L","Adriana"
"147",146,"It was a foggy, cloudy morning, and a dun-coloured veil hung over the house-tops, looking like the reflection of the mud-coloured streets beneath.","L","Landry"
"57",147,"He broke off a sentence and let it swim in his mind.","L","Davide"
"179",148,"Cold abstraction, fleshless skeleton, daughter, mother, and mate of Death!","H","Sveta"
"41",149,"His heart was beating violently with the fear of this liberty.","H","Adriana"
"174",150,"They gave him his dinner in a stone hut like a cubical boulder, with no door or windows in its two openings; a bright fire of sticks  brought on muleback from the first valley below  burning outside, sent in a wavering glare; and two candles in tin candlesticks - lighted, it was explained to him, in his honour - stood on a sort of rough camp table, at which he sat on the right hand of the chief.","L","Sveta"
