"","...1","text","arousal","annotator"
"172",151,"He rose, and stirred about the papers on his table, as if in doubt; he then picked up a manuscript, and after spreading it smoothly upon his knee, he looked up at Katharine suspiciously.","H","Sveta"
"165",152,"Mary could not help feeling the simplicity and good faith that lay behind Katharine's words.","H","Sveta"
"180",153,"With me, then, it seems, you cannot go: but if you are sincere in your offer, I will, while in town, speak to a married missionary, whose wife needs a coadjutor.","L","Sveta"
"29",154,"While giving way to his bitter mirth, the  rover had caught sight of Arlette's face at the, open window of the  lieutenant's room.","L","Adriana"
"18",155,"It might have been the shadow of a driving cloud, so noiseless and rapid was its passage, but for the trail of disturbed grass, whose feathery heads trembled and swayed for a long time in the moonlight before they rested motionless and gleaming, like a design of silver sprays embroidered on a sombre background.","L","Adriana"
"159",156,"He stood up and buckled the belt on, while Peyrol rose more  deliberately from the bench, and said:    ""She can't  be where we saw her at anchor last night.","H","Sveta"
"148",157,"""Let Miss Eyre be seated,"" said he: and there was something in the forced stiff bow, in the impatient yet formal tone, which seemed further to express, ""What the deuce is it to me whether Miss Eyre be there or not?","L","Landry"
"90",158,"""In that field, Adele, I was walking late one evening about a fortnight since - the evening of the day you helped me to make hay in the orchard meadows; and, as I was tired with raking swaths, I sat down to rest me on a stile; and there I took out a little book and a pencil, and began to write about a misfortune that befell me long ago, and a wish I had for happy days to come: I was writing away very fast, though daylight was fading from the leaf, when something came up the path and stopped two yards off me.","L","Davide"
"76",159,"It was a dreadful moment; unhappy; muddled; altogether wrong.","H","Davide"
"55",160,"Great flocks of white birds wheeled screaming above the swaying tree-tops.","H","Davide"
"73",161,"The mill-windows were alight, the bell still rung loud, and now the little children came running in, in too great a hurry, let us hope, to feel very much nipped by the inclement air; and indeed, by contrast, perhaps the morning appeared rather favourable to them than otherwise, for they had often come to their work that winter through snow-storms, through heavy rain, through hard frost.","L","Davide"
"123",162,"When there, a fresh altercation arose between them, in the course of which Drebber received a blow from the stick, in the pit of the stomach, perhaps, which killed him without leaving any mark.","H","Landry"
"131",163,"It would be quite as deadly, and a good deal less noisy than firing across a handkerchief.","L","Landry"
"2",164,"Distrust, the very feeling I dreaded, appeared in Hannah's face.","H","Adriana"
"153",165,"Was he our malignant enemy, or was he by chance our guardian angel?","H","Sveta"
"91",166,"I was certainly feeling very weary, so I obeyed his injunction.","L","Davide"
"199",167,"""Yes, Mrs Egerton,"" said her father, and went on telling his story about Mrs Egerton, ""whose golden hair was said by the voice of slander not to be entirely her own.""","L","Sveta"
"157",168,"For that matter, so great a gap separates these ape-men from the primitive animals which have survived upon this plateau, that it is inadmissible to think that they could have developed where we find them.""","L","Sveta"
"48",169,"I had the same feeling of mystery and danger around us.","H","Adriana"
"116",170,"When I reached him he was groping about frantically in the empty cab, and giving vent to the finest assorted collection of oaths that ever I listened to.","H","Landry"
"51",171,"During a deadly struggle against an irreconcilable enemy his life belonged to his country.","H","Davide"
"3",172,"Then, with a frightful heave they shot the poor wretch over the precipice.","H","Adriana"
"102",173,"How pleasant it was in its air of perfect domestic comfort!","L","Landry"
"129",174,"The greatest demonstration of all, however, was at the entrance of my new acquaintance, Professor Challenger, when he passed down to take his place at the extreme end of the front row of the platform.","H","Landry"
"124",175,"This caused Peyrol to look  at him with intense astonishment.","H","Landry"
"118",176,"""A false step yonder means death to man or beast.","H","Landry"
"168",177,"Then, with a wave of the hand dictated by centuries of tradition, Mrs Larpent drew back her foot, as if she had encroached upon one of the chalk marks which decorate academic lintels and, signifying that Mrs Lathom, wife of the Divinity professor, should precede her, they passed out into the rain.","L","Sveta"
"175",178,"The English would have been interested enough to send a boat  ashore to go through our pockets, and whether dead or only half dead we  wouldn't  have been in a state to prevent them.","L","Sveta"
"114",179,"At the same time, he felt drawn to her as he had never been before; partly, no doubt, because she was more independent of him than in London, and seemed to be attached firmly to a world where he had no place at all.","H","Landry"
"186",180,"And yet nobody could have worked harder or done better in all the recognized stages of a young man's life than Ralph had done, and Joan had to gather materials for her fears from trifles in her brother's behavior which would have escaped any other eye.","H","Sveta"
"66",181,"His legacy was suspense - a worse boon than despair.","H","Davide"
"196",182,"Symons  experienced the feeling of a very narrow escape; yet it brought not much  relief.","L","Sveta"
"17",183,"Their dread of the raving tyrant translated itself into a hasty ferocity of procedure.","L","Adriana"
"56",184,"Fuller knowledge of the organization which produced such terrible results served to increase rather than to lessen the horror which it inspired in the minds of men.","H","Davide"
"4",185,"It confirmed some obscure feeling of his about his own character.","H","Adriana"
"39",186,"I stayed for the most part at Coombe Tracey, and only used the hut upon the moor when it was necessary to be near the scene of action.","L","Adriana"
"130",187,"However, here we possess the advantage of having only one South American Government hanging around for plunder out of the deal.","L","Landry"
"112",188,"It seemed to me that the mists in my own mind were gradually clearing away, and I began to have a dim, vague perception of the truth.","L","Landry"
"44",189,"Now and then he heard voices in the house, and the closing of bedroom doors, which showed that the building, at the top of which he sat, was inhabited in every one of its cells.","L","Adriana"
"36",190,"After supper, he began to ask me many questions, of where I had been, what I had been doing, how I had found him out; but I gave him only very partial replies: it was too late to enter into particulars that night.","L","Adriana"
"58",191,"You quote an isolated sentence from my lecture, and appear to have some difficulty in understanding it.","L","Davide"
"197",192,"Shirley showed she had been sincere in saying she should be glad of Caroline's society, by frequently seeking it; and, indeed, if she had not sought it, she would not have had it, for Miss Helstone was slow to make fresh acquaintance.","L","Sveta"
"164",193,"Miss Ingram was a mark beneath jealousy: she was too inferior to excite the feeling.","L","Sveta"
"132",194,"The person that  came nearest to trying his composure was a certain naval captain with a  patch over one eye and a very threadbare uniform coat who was doing some  administrative work at the Port Office.","L","Landry"
"19",195,"Her father refused to have anything to do with her because she had married without his consent and per- haps for one or two other reasons as well.","L","Adriana"
"50",196,"I had driven some distance when I put my hand into the pocket in which I usually kept Lucy's ring, and found that it was not there.","L","Adriana"
"200",197,"The Admiral, who had been all the time looking absently at the Amelia  keeping her station with the tartane in tow, said:    ""You have a very smart little ship, Vincent.","L","Sveta"
"156",198,"The peaceful penetration of Maple White Land was the pressing subject before us.","L","Sveta"
"34",199,"Chapter 8  First Report of Dr. Watson   From this point onward I will follow the course of events by transcribing my own letters to Mr. Sherlock Holmes which lie before me on the table.","L","Adriana"
"181",200,"He would lead her away to sequestered rustic seats, whence the rush of the surf to the sands was heard soft and soothing; and when he had her all to himself, and the sea lay before them, and the scented shade of gardens spread round, and the tall shelter of cliffs rose behind them, he would pull out his last batch of sonnets, and read them in a voice tremulous with emotion.","H","Sveta"
